[
  {
    "id": "gastrocnemius-calcaneal-tendon",
    "type": "shared_tissue",
    "from": "muscle:gastrocnemius",
    "to": "structure:calcaneal_tendon",
    "evidence": "anatomy",
    "description": "Kaksoiskantalihas yhtyy leveän kantalihaksen kanssa akillesjänteeksi, joka kiinnittyy kantaluuhun.",
    "sources": ["teachme-leg-posterior"]
  },
  {
    "id": "soleus-calcaneal-tendon",
    "type": "shared_tissue",
    "from": "muscle:soleus",
    "to": "structure:calcaneal_tendon",
    "evidence": "anatomy",
    "description": "Leveä kantalihas yhtyy kaksoiskantalihaksen kanssa akillesjänteeksi, joka kiinnittyy kantaluuhun.",
    "sources": ["teachme-leg-posterior"]
  },
  {
    "id": "plantaris-calcaneal-tendon",
    "type": "shared_tissue",
    "from": "muscle:plantaris",
    "to": "structure:calcaneal_tendon",
    "evidence": "anatomy",
    "description": "Jalkapohjalihaksen pitkä jänne sulautuu akillesjänteeseen ja kiinnittyy kantaluuhun.",
    "sources": ["teachme-leg-posterior"]
  },
  {
    "id": "calcaneal-tendon-plantar-aponeurosis",
    "type": "shared_tissue",
    "from": "structure:calcaneal_tendon",
    "to": "structure:plantar_aponeurosis",
    "evidence": "cadaver_study",
    "description": "Akillesjänne ja jalkapohjan kalvojänne kiinnittyvät kumpikin kantaluuhun. Vastasyntyneillä niiden välillä on paksu säieyhteys, joka ohenee iän myötä. Aikuisilla täyttä säieyhteyttä ei ole vahvistettu, mutta rakenteiden koot ovat yhteydessä toisiinsa, ja kalvojänne liittyy kantaluun luukalvon kautta akillesjänteen jännetuppeen.",
    "sources": ["snow-1995", "singh-2021", "stecco-2013"]
  },
  {
    "id": "flexor-digitorum-brevis-plantar-aponeurosis",
    "type": "attachment",
    "from": "muscle:flexor_digitorum_brevis",
    "to": "structure:plantar_aponeurosis",
    "evidence": "anatomy",
    "description": "Varpaiden lyhyt koukistajalihas lähtee osittain jalkapohjan kalvojänteestä.",
    "sources": ["teachme-foot"]
  },
  {
    "id": "abductor-hallucis-plantar-aponeurosis",
    "type": "attachment",
    "from": "muscle:abductor_hallucis",
    "to": "structure:plantar_aponeurosis",
    "evidence": "anatomy",
    "description": "Isonvarpaan loitontajalihas lähtee osittain jalkapohjan kalvojänteestä, ja kalvojänne jatkuu lihaksen ympäryskalvoon.",
    "sources": ["teachme-foot", "stecco-2013"]
  },
  {
    "id": "abductor-digiti-minimi-plantar-aponeurosis",
    "type": "attachment",
    "from": "muscle:abductor_digiti_minimi_pedis",
    "to": "structure:plantar_aponeurosis",
    "evidence": "anatomy",
    "description": "Pikkuvarpaan loitontajalihas lähtee osittain jalkapohjan kalvojänteestä, ja kalvojänne jatkuu lihaksen ympäryskalvoon.",
    "sources": ["teachme-foot", "stecco-2013"]
  },
  {
    "id": "quadratus-plantae-flexor-digitorum-longus",
    "type": "attachment",
    "from": "muscle:quadratus_plantae",
    "to": "muscle:flexor_digitorum_longus",
    "evidence": "anatomy",
    "description": "Jalkapohjan nelikulmainen lihas kiinnittyy varpaiden pitkän koukistajalihaksen jänteisiin.",
    "sources": ["teachme-foot"]
  },
  {
    "id": "lumbricales-flexor-digitorum-longus",
    "type": "attachment",
    "from": "muscle:lumbricales_pedis",
    "to": "muscle:flexor_digitorum_longus",
    "evidence": "anatomy",
    "description": "Jalan matolihakset lähtevät varpaiden pitkän koukistajalihaksen jänteistä.",
    "sources": ["teachme-foot"]
  },
  {
    "id": "flexor-hallucis-brevis-tibialis-posterior",
    "type": "attachment",
    "from": "muscle:flexor_hallucis_brevis",
    "to": "muscle:tibialis_posterior",
    "evidence": "anatomy",
    "description": "Isonvarpaan lyhyen koukistajalihaksen mediaalinen pää lähtee takimmaisen säärilihaksen jänteestä.",
    "sources": ["teachme-foot"]
  },
  {
    "id": "fibularis-tertius-extensor-digitorum-longus",
    "type": "attachment",
    "from": "muscle:fibularis_tertius",
    "to": "muscle:extensor_digitorum_longus",
    "evidence": "anatomy",
    "description": "Kolmas pohjeluulihas lähtee pohjeluusta yhdessä varpaiden pitkän ojentajalihaksen kanssa.",
    "sources": ["teachme-leg-anterior"]
  },
  {
    "id": "extensor-digitorum-brevis-extensor-digitorum-longus",
    "type": "attachment",
    "from": "muscle:extensor_digitorum_brevis",
    "to": "muscle:extensor_digitorum_longus",
    "evidence": "anatomy",
    "description": "Varpaiden lyhyt ojentajalihas kiinnittyy toisen–neljännen varpaan pitkiin ojentajajänteisiin.",
    "sources": ["teachme-foot"]
  },
  {
    "id": "quadratus-plantae-heel-referred-pain",
    "type": "referred_pain",
    "from": "muscle:quadratus_plantae",
    "to": "region:heel",
    "evidence": "contested",
    "description": "Tapaus-verrokkitutkimuksessa kantapään alapinnan kipua sairastavilla oli useimmin aktiivisia trigger pointeja jalkapohjan nelikulmaisessa lihaksessa, ja jalkaterän lihaksista heijastunut kipu toisti potilaiden oireet. Trigger point -mallin tieteellinen perusta on kiistanalainen, vaikka itse kipuilmiöt ovat todellisia.",
    "sources": ["ortega-santiago-2020", "quintner-2015"]
  },
  {
    "id": "flexor-hallucis-brevis-heel-referred-pain",
    "type": "referred_pain",
    "from": "muscle:flexor_hallucis_brevis",
    "to": "region:heel",
    "evidence": "contested",
    "description": "Tapaus-verrokkitutkimuksessa kantapään alapinnan kipua sairastavilla oli usein aktiivisia trigger pointeja isonvarpaan lyhyessä koukistajalihaksessa, ja jalkaterän lihaksista heijastunut kipu toisti potilaiden oireet. Trigger point -mallin tieteellinen perusta on kiistanalainen, vaikka itse kipuilmiöt ovat todellisia.",
    "sources": ["ortega-santiago-2020", "quintner-2015"]
  },
  {
    "id": "tensor-fasciae-latae-iliotibial-tract",
    "type": "attachment",
    "from": "muscle:tensor_fasciae_latae",
    "to": "structure:iliotibial_tract",
    "evidence": "anatomy",
    "description": "Leveän peitinkalvon jännittäjälihas kiinnittyy suoliluu-sääriluukaistaan.",
    "sources": ["teachme-gluteal"]
  },
  {
    "id": "gluteus-maximus-iliotibial-tract",
    "type": "attachment",
    "from": "muscle:gluteus_maximus",
    "to": "structure:iliotibial_tract",
    "evidence": "anatomy",
    "description": "Iso pakaralihas kiinnittyy suoliluu-sääriluukaistaan ja reisiluun pakarakyhmyyn.",
    "sources": ["teachme-gluteal"]
  },
  {
    "id": "rectus-femoris-quadriceps-tendon",
    "type": "shared_tissue",
    "from": "muscle:rectus_femoris",
    "to": "structure:quadriceps_tendon",
    "evidence": "anatomy",
    "description": "Suora reisilihas kiinnittyy polvilumpioon nelipäisen reisilihaksen yhteisen jänteen kautta; polvilumpio kiinnittyy sääriluun kyhmyyn polvilumpiositeellä.",
    "sources": ["teachme-thigh-anterior"]
  },
  {
    "id": "vastus-lateralis-quadriceps-tendon",
    "type": "shared_tissue",
    "from": "muscle:vastus_lateralis",
    "to": "structure:quadriceps_tendon",
    "evidence": "anatomy",
    "description": "Ulompi reisilihas kiinnittyy polvilumpioon nelipäisen reisilihaksen yhteisen jänteen kautta; polvilumpio kiinnittyy sääriluun kyhmyyn polvilumpiositeellä.",
    "sources": ["teachme-thigh-anterior"]
  },
  {
    "id": "vastus-intermedius-quadriceps-tendon",
    "type": "shared_tissue",
    "from": "muscle:vastus_intermedius",
    "to": "structure:quadriceps_tendon",
    "evidence": "anatomy",
    "description": "Keskimmäinen reisilihas kiinnittyy polvilumpioon nelipäisen reisilihaksen yhteisen jänteen kautta; polvilumpio kiinnittyy sääriluun kyhmyyn polvilumpiositeellä.",
    "sources": ["teachme-thigh-anterior"]
  },
  {
    "id": "vastus-medialis-quadriceps-tendon",
    "type": "shared_tissue",
    "from": "muscle:vastus_medialis",
    "to": "structure:quadriceps_tendon",
    "evidence": "anatomy",
    "description": "Sisempi reisilihas kiinnittyy polvilumpioon nelipäisen reisilihaksen yhteisen jänteen kautta; polvilumpio kiinnittyy sääriluun kyhmyyn polvilumpiositeellä.",
    "sources": ["teachme-thigh-anterior"]
  },
  {
    "id": "sartorius-pes-anserinus",
    "type": "shared_tissue",
    "from": "muscle:sartorius",
    "to": "structure:pes_anserinus",
    "evidence": "anatomy",
    "description": "Räätälinlihas kiinnittyy hanhenjalkaan, räätälinlihaksen, hoikkalihaksen ja puolijänteisen lihaksen yhteiseen kiinnityskohtaan sääriluun yläosan mediaalisella pinnalla.",
    "sources": ["fipat-ta2", "teachme-thigh-anterior"]
  },
  {
    "id": "gracilis-pes-anserinus",
    "type": "shared_tissue",
    "from": "muscle:gracilis",
    "to": "structure:pes_anserinus",
    "evidence": "anatomy",
    "description": "Hoikkalihas kiinnittyy hanhenjalkaan, räätälinlihaksen, hoikkalihaksen ja puolijänteisen lihaksen yhteiseen kiinnityskohtaan sääriluun yläosan mediaalisella pinnalla.",
    "sources": ["fipat-ta2", "teachme-thigh-medial"]
  },
  {
    "id": "semitendinosus-pes-anserinus",
    "type": "shared_tissue",
    "from": "muscle:semitendinosus",
    "to": "structure:pes_anserinus",
    "evidence": "anatomy",
    "description": "Puolijänteinen lihas kiinnittyy hanhenjalkaan, räätälinlihaksen, hoikkalihaksen ja puolijänteisen lihaksen yhteiseen kiinnityskohtaan sääriluun yläosan mediaalisella pinnalla.",
    "sources": ["fipat-ta2", "teachme-thigh-posterior"]
  },
  {
    "id": "iliacus-psoas-major",
    "type": "shared_tissue",
    "from": "muscle:iliacus",
    "to": "muscle:psoas_major",
    "evidence": "anatomy",
    "description": "Suoliluulihas ja suuri lannelihas kiinnittyvät yhdessä reisiluun pieneen sarvennoiseen.",
    "sources": ["teachme-thigh-anterior"]
  },
  {
    "id": "biceps-femoris-semitendinosus",
    "type": "attachment",
    "from": "muscle:biceps_femoris",
    "to": "muscle:semitendinosus",
    "evidence": "anatomy",
    "description": "Kaksipäisen reisilihaksen pitkä pää ja puolijänteinen lihas lähtevät molemmat istuinkyhmystä.",
    "sources": ["teachme-thigh-posterior"]
  },
  {
    "id": "semimembranosus-semitendinosus",
    "type": "attachment",
    "from": "muscle:semimembranosus",